<?xml version="1.0"?>
<order xmlns:xsi='http://www.w3.org/2001/XMLSchema-instance'
    xsi:noNamespaceSchemaLocation='ordersXmlSchema.xsd'>
  <agreements>
    <agreement>
        <name>Иванов Петр Васильевич</name>
        <date>24.08.2019</date>
    </agreement>
    <agreement>
        <name>Петров Николай Ректорович</name>
        <date>25.08.2019</date>
    </agreement>
    <agreement>
        <name>Смирнов Андрей Директорович</name>
        <date>24.08.2019</date>
    </agreement>
  </agreements>
  
  <direction 
        code="09.02.03"
        name="Программирование в компьютерных системах стандарт">
        <groups>
            <group number="4441">
                <student>
                    <number>1</number>
                    <name>Имя Фамилия Отчество</name>
                    <type>1</type>
                </student>
                <student>
                    <number>2</number>
                    <name>Имя Фамилия Отчество</name>
                    <type>1</type>
                </student>
                <student>
                    <number></number>
                    <name>Имя Фамилия Отчество</name>
                    <type>2</type>
                </student>
            </group>
        </groups>
    </direction>
    
    <direction 
        code="09.02.02"
        name="Компьютерные сети">
        <groups>
            <group number="4436">
                <student>
                    <number>1</number>
                    <name>Имя Фамилия Отчество</name>
                    <type>2</type>
                </student>
                <student>
                    <number>2</number>
                    <name>Имя Фамилия Отчество</name>
                    <type>2</type>
                </student>
                <student>
                    <number></number>
                    <name>Имя Фамилия Отчество</name>
                    <type>2</type>
                </student>
            </group>
        </groups>
    </direction>
</order>
